{
  "id": "hubble_tension",
  "name": "Hubble tension",
  "aliases": ["H0 tension"],
  "domain": "cosmology",
  "observable": {
    "symbol": "H_0",
    "description": "Present-day expansion rate of the universe. Late-universe distance-ladder measurements (Cepheids + Type Ia supernovae) give a value persistently higher than the value inferred by fitting LambdaCDM to early-universe CMB data.",
    "units": "km/s/Mpc"
  },
  "characteristic_scale": {
    "length_m": 1.3e26,
    "energy_ev": 1.4e-33,
    "note": "Hubble radius ~ c/H_0 ~ 4.4 Gpc. Energy scale is the corresponding Hubble parameter expressed as eV. The tension itself spans the gap between local (Mpc) distance ladder and last-scattering surface (Gpc) physics."
  },
  "standard_prediction": {
    "model": "LambdaCDM fit to Planck 2018 CMB (TT,TE,EE+lowE+lensing)",
    "value": 67.36,
    "uncertainty": 0.54,
    "units": "km/s/Mpc",
    "method_variants": [
      {
        "label": "ACT DR4 + WMAP",
        "value": 67.6,
        "uncertainty": 1.1,
        "reference": "Aiola et al. 2020, arXiv:2007.07288",
        "note": "Independent CMB pipeline, consistent with Planck."
      },
      {
        "label": "BAO + BBN (no CMB)",
        "value": 67.5,
        "uncertainty": 1.1,
        "reference": "Schoneberg, Lesgourgues, Hooper, 'The BAO+BBN take on the Hubble tension', JCAP 10, 029 (2019), arXiv:1907.11594",
        "note": "Sound-horizon-anchored inverse distance ladder gives essentially the same low value without CMB."
      }
    ],
    "references": [
      "Planck 2018 Results VI: Cosmological Parameters, A&A 641, A6 (2020), arXiv:1807.06209"
    ]
  },
  "measurements": [
    {
      "experiment": "SH0ES (Cepheid + SN Ia distance ladder)",
      "value": 73.04,
      "uncertainty": 1.04,
      "units": "km/s/Mpc",
      "year": 2022,
      "reference": "Riess et al., ApJL 934, L7 (2022), arXiv:2112.04510"
    },
    {
      "experiment": "CCHP (TRGB + SN Ia)",
      "value": 69.8,
      "uncertainty": 1.7,
      "units": "km/s/Mpc",
      "year": 2024,
      "reference": "Freedman et al. 2024, arXiv:2408.06153",
      "note": "Tip-of-the-Red-Giant-Branch calibration sits between SH0ES and Planck. The choice of distance-ladder rung is itself contested."
    },
    {
      "experiment": "JWST + HST (SH0ES re-validation)",
      "value": 73.0,
      "uncertainty": 1.0,
      "units": "km/s/Mpc",
      "year": 2024,
      "reference": "Riess et al., 'JWST Observations Reject Unrecognized Crowding of Cepheid Photometry as an Explanation for the Hubble Tension at 8 sigma Confidence', ApJL 962, L17 (2024), arXiv:2401.04773",
      "note": "JWST imaging of HST Cepheid hosts rejects unrecognized-crowding bias as the explanation for the SH0ES tension at 8.2 sigma; the SH0ES baseline H0 ~ 73 is reaffirmed."
    },
    {
      "experiment": "JWST + HST joint H0 (Riess 2024b)",
      "value": 72.6,
      "uncertainty": 2.0,
      "units": "km/s/Mpc",
      "year": 2024,
      "reference": "Riess et al., 'JWST Validates HST Distance Measurements: Selection of Supernova Subsample Explains Differences in JWST Estimates of Local H0', arXiv:2408.11770",
      "note": "Joint JWST + HST distance ladder. Argues that subsample-selection effects (not Cepheid systematics) explain low-H0 JWST claims by other groups."
    },
    {
      "experiment": "H0LiCOW / TDCOSMO (strong-lensing time delays)",
      "value": 73.3,
      "uncertainty": 1.8,
      "units": "km/s/Mpc",
      "year": 2020,
      "reference": "Wong et al., MNRAS 498, 1420 (2020), arXiv:1907.04869",
      "note": "Independent of distance ladder. With more conservative lens-mass priors (TDCOSMO 2020), uncertainty grows."
    }
  ],
  "tension_history": [
    {
      "year": 2013,
      "sigma": 2.4,
      "comparison": "Riess 2011 vs Planck 2013",
      "note": "First time the discrepancy was widely flagged."
    },
    {
      "year": 2019,
      "sigma": 4.4,
      "comparison": "SH0ES 2019 vs Planck 2018",
      "note": "Riess et al. 2019, arXiv:1903.07603."
    },
    {
      "year": 2022,
      "sigma": 5.0,
      "comparison": "SH0ES 2022 vs Planck 2018",
      "note": "Headline 5-sigma claim."
    },
    {
      "year": 2024,
      "sigma": 5.0,
      "comparison": "SH0ES + JWST vs Planck 2018",
      "note": "JWST data weakened the case that the SH0ES result is a Cepheid systematic. Tension persists."
    }
  ],
  "status": "open",
  "trend": "stable",
  "principles_stressed": [
    {
      "principle": "none",
      "status": "none",
      "note": "Parameter inconsistency between two pipelines for inferring H_0 within LambdaCDM. Does not directly violate unitarity, causality, Lorentz invariance, the equivalence principle, or any gauge structure. If real, it indicates LambdaCDM is incomplete, not that a foundational principle is wrong."
    }
  ],
  "cosmology_context": {
    "extension_classes": [
      {
        "name": "Early Dark Energy (EDE)",
        "effect": "An additional energy component that briefly dominates around matter-radiation equality reduces the sound horizon r_s, raising the inferred local H_0 from CMB-anchored data toward ~71-72.",
        "cost_elsewhere": "Best-fit EDE worsens the S_8 / structure-growth tension and is in tension with Big Bang Nucleosynthesis fits in the most economical realizations.",
        "reference": "Poulin, Smith, Karwal, Kamionkowski, PRL 122, 221301 (2019), arXiv:1811.04083; Hill et al. 2020, arXiv:2003.07355"
      },
      {
        "name": "Dark radiation / extra N_eff",
        "effect": "Increasing N_eff raises H(z) at recombination and shifts inferred H_0 upward by a few percent.",
        "cost_elsewhere": "Tightly constrained by CMB damping tail (Planck high-l) and BBN deuterium abundances. Cannot fully close the gap without violating CMB-shape constraints.",
        "reference": "Vagnozzi, PRD 102, 023518 (2020), arXiv:1907.07569"
      },
      {
        "name": "Sign-switching cosmological constant (Lambda_s CDM)",
        "effect": "Lambda flips sign at z ~ 2 (negative -> positive). Changes the late-time expansion history and can move H_0 toward the SH0ES value while preserving CMB.",
        "cost_elsewhere": "Requires an exotic transition mechanism with no established UV completion; phenomenological rather than fundamental.",
        "reference": "Akarsu, Barrow, Escamilla, Vazquez, PRD 101, 063528 (2020), arXiv:1912.08751"
      },
      {
        "name": "Modified recombination / varying m_e",
        "effect": "A shift in the electron mass (or other recombination physics) at z ~ 1100 changes r_s and the inferred H_0.",
        "cost_elsewhere": "Time-varying fundamental constants are tightly constrained by quasar absorption spectra and atomic-clock comparisons; the required shift is in some tension with these.",
        "reference": "Hart and Chluba, MNRAS 493, 3255 (2020), arXiv:1912.03986"
      },
      {
        "name": "Interacting dark energy / dark sector",
        "effect": "Energy exchange between dark matter and dark energy modifies late-time expansion; some models reach intermediate H_0 values.",
        "cost_elsewhere": "Most viable models close less than half of the gap and still leave residual tension in joint CMB+BAO+SN fits.",
        "reference": "Di Valentino, Melchiorri, Mena, Vagnozzi, PRD 101, 063502 (2020), arXiv:1910.09853"
      }
    ]
  },
  "summary": "The locally-measured expansion rate (Cepheid-anchored distance ladder, anchored further by JWST as of 2024) is ~73 km/s/Mpc, while LambdaCDM applied to Planck CMB data and to BAO+BBN inverse distance ladders gives ~67.4. The ~5 sigma discrepancy has survived multiple independent cross-checks. Either there is a systematic in one of the two pipelines that has eluded a decade of scrutiny, or LambdaCDM is incomplete. Proposed solutions (early dark energy, modified recombination, varying fundamental constants) so far each create new tensions elsewhere.",
  "systematics_notes": "TRGB-based calibrations sit between the two values, and the Cepheid-vs-TRGB debate is itself active. Time-delay strong lensing gives high values but with large lens-modeling uncertainties. Megamaser distances (e.g., Pesce et al.) also support a high local value. No single early-universe extension to LambdaCDM cleanly resolves H0 without violating BAO, S8, or CMB damping-tail constraints.",
  "references": [
    {
      "citation": "Riess et al., 'A Comprehensive Measurement of the Local Value of the Hubble Constant with 1 km/s/Mpc Uncertainty from the Hubble Space Telescope and the SH0ES Team', ApJL 934, L7 (2022)",
      "arxiv": "2112.04510"
    },
    {
      "citation": "Planck Collaboration, 'Planck 2018 results. VI. Cosmological parameters', A&A 641, A6 (2020)",
      "arxiv": "1807.06209"
    },
    {
      "citation": "Riess et al., 'JWST Observations Reject Unrecognized Crowding of Cepheid Photometry as an Explanation for the Hubble Tension at 8 sigma Confidence', ApJL 962, L17 (2024)",
      "arxiv": "2401.04773"
    },
    {
      "citation": "Riess et al., 'JWST Validates HST Distance Measurements: Selection of Supernova Subsample Explains Differences in JWST Estimates of Local H0' (2024)",
      "arxiv": "2408.11770"
    },
    {
      "citation": "Schoneberg, Lesgourgues, Hooper, 'The BAO+BBN take on the Hubble tension', JCAP 10, 029 (2019)",
      "arxiv": "1907.11594"
    },
    {
      "citation": "Freedman et al., 'Status Report on the Chicago-Carnegie Hubble Program (CCHP)' (2024)",
      "arxiv": "2408.06153"
    },
    {
      "citation": "Di Valentino et al., 'In the Realm of the Hubble Tension - A Review of Solutions', Class. Quantum Grav. 38, 153001 (2021)",
      "arxiv": "2103.01183"
    }
  ],
  "tags": ["lambda_cdm", "expansion_rate", "distance_ladder", "cmb", "early_universe"]
}
